,charity_name,address,city,state,zipcode,url,phone_number,email,category_name,charity_description,charity_tag,logo,ruling_year,assets,income,expenses,irs_form
270,Boulder Treasures Inc,1638 PEARL ST,Boulder,CO,80302,http://bouldertreasures.org/,(720) 778-1357,info@bouldertreasures.org,Education,"Boulder Treasures is creating professional businesses through which we can train individuals with developmental disabilities. Our first endeavor is a retail clothing store, Ramble On Pearl. In our program, apprentices will learn transferrable job skills while gaining valuable experience working alongside our retail staff. Individuals will work up to 20 hours per week under the supervision of a skilled job coach and alongside our retail staff who have been trained to provide natural supports to ensure their success. After demonstrating independence, our apprentices will continue to gain work experience without a job coach. After approximately 3 months in training, our apprentices will then be provided job placement services to secure independent, competitive, and sustainable employment in the community.

Our businesses will showcase the employability of our apprentices to future employers, while enhancing our customers’ awareness of the many contributions our staff with developmental disabilities have to offer. Our initial goal is to train and successfully place 20 apprentices a year into permanent employment by 2015. Our ultimate goal is to become a trusted source of enthusiastic and reliable employees for the broader employment market in Boulder.",The mission of Boulder Treasures is to operate an apprenticeship program for persons with intellectual and developmental disabilities that provides on-the-job training in real world environments and job placement services to secure their independent employment in an inclusive community,http://bouldertreasures.org/bouldertreasureswp/wp-content/uploads/2014/07/bt_horz_400-copy.png,2014,"$216,689","$455,238",NULL,http://www.guidestar.org/FinDocuments/2017/464/099/2017-464099034-0e996725-9.pdf
271,Boulder United Methodist Missionpartners Bummp Inc,1421 SPRUCE ST,Boulder,CO,80302,https://fumcboulder.org/service-and-community/boulder-united-methodist-mission-partners-bummp/,303-442-3770,office@fumcboulder.org,Religious,"Here at First United Methodist Church of Boulder, we believe that human beings experience longing for meaning, purpose, connection to others and a desire for transcendence beyond oneself. From early in the history of humanity, religions emerged and evolved in response to that longing.

But we also know that while the institutions spawned by religion have had many positive influences, they also at times have inflicted great pain. For that reason, many people consider themselves to be “spiritual but not religious.”

We believe that how we treat each other and the world we live in is far more important than any recitation or adherence to a particular dogma. We feel that those who are spiritual seekers should be welcomed with open arms regardless of the path to compassionate action they might choose.

FUMC Boulder offers various opportunities to those who consider themselves Spiritual But Not Religious. We welcome individuals to explore these opportunities and share in our community of compassion.",First United Methodist Church of Boulder welcomes everyone. We believe that we love God best by loving others.,https://fumcboulder.org/wp-content/uploads/2018/03/fumc-logo2x.png,2009,NULL,NULL,NULL,NULL
272,Boulder Valley Rotary Foundation,1801 13TH ST STE 210,Boulder,CO,80302,https://www.bouldervalleyrotary.club/,303-449-5552,programs@bouldervalleyrotary.club,Education,"Our Rotary club is a very active, socially engaged group of professionals. Our 70 members come together weekly to better our community and world, enjoy each others’ company, be inspired, and learn something from our speakers. You can download a summary page about our club and its activities. 
Our club members help the Boulder community through the club’s grants program and fun volunteer events. We have rebuilt corrals at Medicine Horse, served dinner at Community Table, and held a joint meeting with immigrant English students from Intercambio de Comunidades.","Our Rotary club is a very active, socially engaged group of professionals.",https://www.bouldervalleyrotary.club/wp-content/uploads/2016/06/BVRC-logo-small.jpg,2018,"$548,995","$56,864",NULL,https://www.guidestar.org/FinDocuments/2017/841/174/2017-841174550-0eeb552f-F.pdf
273,Boulder Writing Studio,777 PEARL STREET,Boulder,CO,80302,http://www.boulderwritingstudio.org/,NULL,info@boulderwritingstudio.org,Art & Culture,"Boulder Writing Studio was founded to support emerging local voices and connect our community through the literary arts. Since 2010, the studio has cultivated the art and craft of writing, the bold magic of self-expression, and the power of the written word to transform our individual and collective lives. Boulder Writing Studio offers workshops, editorial services, community events, and youth programs for writers in Boulder and its neighboring communities. ",Boulder Writing Studio was founded to support emerging local voices and connect our community through the literary arts.,http://static1.squarespace.com/static/55299333e4b00901637b2a3b/t/5806bc3c197aeafadf7e4673/1543452529896/?format=1500w,2011,NULL,NULL,NULL,NULL
274,Bouldershares,1942 BROADWAY STE 314,Boulder,CO,80302,http://www.bouldershares.org/,303-209-3726,leslie@bouldershares.org,Human Services,"“BoulderShares” was the name first given to loosely organized events and missions whereby soft goods were procured from local Boulder-area companies, shipped via American Airlines® and distributed to less fortunate communities in the Caribbean basin and Central America.

Several events and missions were organized in Haiti from 2007 to present in partnership with Non-Governmental Organizations (NGOs) including: Airline Ambassadors International, The Carma Foundation, The Colorado Haiti Project, Edeyo Foundation, Global Outreach and Love of Soccer (GOALS) Haiti, Hand in Hand for Haiti, Health 4 Haiti, The Holy Trinity Music School, International Medical Relief (IMR), J/P HRO, Project Medishare and Renewal 4 Haiti.","BoulderShares visits several projects quarterly, at our own expense, bringing resources and funding to those with the greatest potential to improve the lives of women and children in the region. ",http://www.bouldershares.org/images/BoulderShares-logo-2015.jpg,2017,"$33,142","$91,250",NULL,https://www.guidestar.org/FinDocuments/2017/475/669/2017-475669164-0f4ecb85-Z.pdf
275,Brett Family Foundation,6224 BEAVER CREEK RD,Boulder,CO,80302,https://www.charitynavigator.org/index.cfm?bay=search.profile&ein=262086392,303-442-1200,info@brettfoundation.org,Education,"Linda Shoemaker and her husband, Steve Brett, founded the Brett Family Foundation in the millennium year of 2000 with the vision of helping make Colorado a more compassionate and just place for all who live here. This continues to be the guiding force directing the Foundation's goals: to foster a society whose hallmarks include strong democracy, healthy and inclusive communities, equal rights and access to opportunity for all, and a commitment to the common good.

Linda and Steve serve as trustees of the Brett Family Foundation and, along with their three adult children, direct the Foundation's grantmaking according to the Guiding Principles. The Foundation invests in organizations working for social justice, developing nonprofit media, and Boulder County nonprofits addressing the needs of at-risk teens.","The Brett Family Foundation supports caring communities by investing in organizations throughout Colorado working for social justice, developing nonprofit media, and Boulder County nonprofits addressing the needs of at-risk teens.",http://www.brettfoundation.org/files/garland_logo.png,2012,$200,"$1,000",NULL,https://www.guidestar.org/FinDocuments/2016/841/525/2016-841525821-0dcab7a4-F.pdf
276,Bridge To Justice,1123 Spruce Street Suite 200,Boulder,CO,80302,http://www.boulderbridgetojustice.org/,(303) 443-1038,admin@boulderbridgetojustice.org,Human Services,"Bridge to Justice’s mission is to “bridge the gap” by assisting individuals who do not qualify for free legal services through Boulder County Legal Services or other legal aid providers but who cannot afford a private attorney.

We provide services to clients based on the 2018 HUD Low Income Guidelines, as outlined on the right. Clients cannot have assets greater than the income cap, excluding primary residence and primary vehicle. We provide limited-scope, or ""unbundled"" legal services, or full-scope representation.

Please note, we have changed our rates as of May 1, 2018. For those who qualify, we charge a reduced rate for our representation:"," As an impact-oriented  social enterprise, our mission is to bridge the gap between legal needs and legal access with affordable, high quality legal services.",NULL,2014,"$69,369","$285,954","$250,697",https://www.guidestar.org/FinDocuments/2016/462/420/2016-462420887-0e92e174-9.pdf
277,Caribbean Coral Restoration Center,2525 ARAPAHOE AVE UNIT E4,Boulder,CO,80302,https://www.coralrestoration.org/,(305) 453-7030,info@coralrestoration.org,Environment,"We have developed a method for “farming” and “outplanting” colonies of staghorn and elkhorn. 

By hanging finger-sized fragments of these corals to grow on Coral Trees™, we can produce colonies that are large enough to be outplanted in just six to nine months.

To date, we have now planted more than 66,000 corals back onto the Florida Reef Tract.",We were founded in response to the wide-spread loss of the dominant coral species on the Florida Reef Tract.,"https://static.wixstatic.com/media/60a969_61dc2cd241c840d0adf539a510556025~mv2.jpg/v1/fill/w_413,h_216,al_c,q_80,usm_0.66_1.00_0.01/Coral%20Restoration%20Foundation%20Primary%20Log.webp",2016,NULL,NULL,NULL,NULL
278,Co Labs Inc,2440 PEARL ST,Boulder,CO,80302,http://co-labs.org/,720-389-0455,dan@co-labs.org,Education,"Advancing Colorado's global competitiveness through an interactive, widely supported community of federally funded laboratories, universities, and business.

The CO-LABS consortium includes Colorado federal research laboratories, research universities, state and local governments, economic development organizations, private businesses and nonprofit organizations.   It conducts economic analysis, encourages technology collaboration and provides education programming.   Colorado’s research laboratories are often called upon to solve state, national, and global issues.  CO-LABS plays an important role in bringing together the collective research and development expertise from Colorado. 

Established in 2007, CO-LABS is a tax exempt 501c3 that relies on donations from its partners and the public to fund its activities.  To find out more about becoming a CO-LABS partner contact Executive Director Dan Powers at 720-389-0455 or dan@co-labs.org. ","CO-LABS educates the public, businesses, educational organizations, and government entities about the value of the federally funded laboratories, creates connections between these sectors, and supports retention and expansion of Colorado's scientific resources.",http://co-labs.org/assets/img/co-labs-logo.png,2008,"$40,248","$49,821",NULL,https://www.guidestar.org/FinDocuments/2016/260/373/2016-260373539-0e31beb0-Z.pdf
279,Colorado Chautauqua Association,900 Baseline Rd,Boulder,CO,80302,https://www.chautauqua.com/,303-442-3282,info@chautauqua.com,Human Services,"The mission of the Colorado Chautauqua Association is to preserve, perpetuate and improve the site and spirit of the historic Chautauqua by enhancing its community and values through cultural, educational, social and recreational experiences.

The Chautauqua experience is based on lifelong learning, love of nature, voluntary simplicity, and music, oration and the arts.  Historic significance, traditions, cultural relevance, respite and enrichment are among the community benefits provided by the Colorado Chautauqua.","Preserve, perpetuate and improve the site and spirit of the historic Chautauqua by enhancing its community and values through cultural, educational, social and recreational experiences.",https://www.chautauqua.com/wp-content/uploads/2018/03/120th_Chautauqua_white-retina.png,1954,"$9,019,984","$5,453,207",NULL,http://www.guidestar.org/FinDocuments/2017/840/447/2017-840447931-0f5a7012-9.pdf
280,Colorado Green Building Foundation,1800 BROADWAY STE 200,Boulder,CO,80302,https://cgbg.org/,720-435-0770,admin@cgbgonline.org,Environment,"The Colorado Green Building Guild is a non-profit trade organization representing a wide range of green building leaders, and serving the community at large by making green building common practice and accessible to all. Based in Boulder, CGBG strives to ensure the widespread adoption of sustainable practices to increase the efficient use of resources, create healthier buildings, and support vibrant, sustainable communities throughout all of Colorado! 

Through community events, from educational workshops and themed seminars, to social gatherings, Green Home Tours and networking opportunities, CGBG offers its members, sponsors and partners the chance to share their knowledge, increase their business opportunities, and advance the art and science of green building. ","The Colorado Green Building Guild is a non-profit trade organization representing a wide range of green building leaders, and serving the community at large by making green building common practice and accessible to all.",https://static1.squarespace.com/static/5ac3c68055b02ce8b735f455/t/5ada1d7388251b0693e4d21a/1543610872641/?format=1500w,2009,"$5,656",NULL,NULL,https://www.guidestar.org/FinDocuments/2009/205/005/2009-205005787-06537ab6-Z.pdf
281,Colorado Mountain Horse Rescue,10077 GOLD HILL RD,Boulder,CO,80302,https://www.mountainvalleyhorserescue.com/,970-376-1743,info@mvhr.net,Environment,"Today, there are an estimated 170,000 unwanted horses across the nation, with 6,000 in Colorado alone. Of these, 120,000–130,000 horses are shipped to slaughter in Mexico and Canada every year, where they are processed for human consumption. In addition, each year the BLM rounds up 9,400 wild horses off of public lands, but only 1 in 3 find homes.

We help reduce horse abuse and neglect through education and outreach and through relationships with local law enforcement concerned citizens and private horse owners. When possible, MVHR networks to find horses new private homes. When necessary, horses are taken in and cared for by us with the ultimate goal of returning them to full health and adoption into a loving, forever home.

To meet this goal, each horse is provided with food, shelter, care, medical treatment, and training to help them become adoptable. As space and funding allow, a limited number of horses are provided sanctuary care at the facility for the rest of their lives.","Mountain Valley Horse Rescue (MVHR) is a 501(c)3 nonprofit organization committed to rescuing, rehabilitating, and re-homing abused, neglected, abandoned, and unwanted horses.",https://static1.squarespace.com/static/59dbbb234c326dbd25af35aa/t/59fc8c0cc83025977866f908/1543450169798/?format=1500w,2017,NULL,NULL,NULL,NULL
282,Colorado Music Festival,900 BASELINE ROAD - COTTAGE 200,Boulder,CO,80302,https://www.comusic.org/,(303) 665-0599,info@comusic.org,Art & Culture,"The Rocky Mountain Center for Musical Arts was founded in 1995 by Kathy Kucsan and Peggy Bruns. The Colorado Music Festival completed its 39th summer in 2016. The two merged in 2009 and in 2013 the new name Colorado Music Festival & Center for Musical Arts was chosen.
Colorado Music Festival & Center for Musical Arts is a one-of-a-kind organization that provides a broad spectrum of music education opportunities and world-class performances to citizens throughout Boulder County and beyond. 
Colorado Music Festival presents a six-week summer concert season at Chautauqua Auditorium in Boulder showcasing Music Director Jean-Marie Zeitouni and the Colorado Music Festival Orchestra. Inspired programming performed by exceptional national and international musicians has earned Colorado Music Festival recognition from the League of American Orchestras and the National Endowment for the Arts.",Our mission is to inspire and connect community members of all ages by providing access to the best of the world’s music through education and performance. ,https://www.comusic.org/wp-content/themes/comusictheme/images/header-logo.svg,1976,"$1,443,659","$2,407,926",NULL,https://www.guidestar.org/FinDocuments/2016/840/735/2016-840735716-0e1275a0-9.pdf
283,Colorado Regional Meeting Of The Religious Society Of Friends,10107 GOLD HILL RD,Boulder,CO,80302,https://www.fgcquaker.org/cloud/mountain-view-friends-meeting/announcements/colorado-regional-meeting,NULL,info@fgcquaker.org,Religious,"Come be part of our Colorado Regional Meeting community at the YMCA of the Rockies — Estes Park Center, October 19-21. The Colorado Regional Meeting registration form is available on the back table in the Meetinghouse and at imym.org (under news). Forms should be postmarked no later than September 15. Our guest for Colorado Regional Meeting will be Quaker historian and theologian Paul Buckley. The theme for the weekend, which grows out of Paul’s research, is “Reviving Quakerism: Building Communities of Love, Hope, and Joy.” Age-appropriate children’s programs are provided. When you come into the meetinghouse before worship you may find some Friends already sitting in silence. There is generally a “centering” that occurs at the beginning of Meetings when Friends seek to clear their minds of distractions and come to a receptive state. We listen and wait for a direct experience of the Divine. Some may be moved to share their experience by standing and speaking. About 15 minutes before the end of worship, the children enter the room to join us in worship. The meeting ends when friends shake hands and greet each other. Following worship, Friends share joys and sorrows, welcome new people, share announcements and enjoy a time of fellowship.","Mountain View Friends Meeting is a Meeting of the Religious Society of Friends (often known as ""Quakers""). We welcome people from all faiths and those of no particular faith. We are all seeking the Divine together.",https://www.fgcquaker.org/sites/default/files/styles/cloud_header_logo/public/group_logos/mvfm_header.png?itok=l8-Bgsi-,1992,NULL,NULL,NULL,NULL
284,Conscious Alliance,2525 ARAPAHOE AVE UNIT E4,Boulder,CO,80302,https://www.consciousalliance.org/,(720) 406-7871,info@consciousalliance.org,Human Services,"All people require and deserve nutritious food to learn, grow, work, and live healthy lives. Unfortunately, one in seven people in the US face hunger and food insecurity. There are children and adults without enough to eat in every community. Your neighbor, co-worker, friend, or family member may struggle today with the difficult choice between food, housing, or medical care. Added to the challenges, those affected by hunger are three times more likely to have chronic health problems, like diabetes or hypertension.

Conscious Alliance combats hunger and nutrition-related diseases by striving to provide the healthiest food possible to those in need. To do this, we build an alliance of donors, volunteers, members, and community partners with a shared goal of increasing access to healthy food. We aim to empower as many people as possible to take action within their own lives and communities.",Conscious Alliance is a national nonprofit organization committed to supporting communities in crisis through hunger relief and youth empowerment. ,https://www.consciousalliance.org/wp-content/themes/ca-4.0/images/conscious-alliance-logo.png,2003,"$198,102","$1,834,290",NULL,https://www.guidestar.org/FinDocuments/2016/270/035/2016-270035894-0df9e6b1-9.pdf
285,Dairy Center For The Arts,2590 WALNUT ST STE 5,Boulder,CO,80302,https://www.thedairy.org/Online/default.asp?BOparam::WScontent::loadArticle::permalink=thedairyhttps://tickets.thedairy.org/Online/default.asp?BOparam::WScontent::loadArticle::permalink=thedairy,303-440-7826,contact@thedairy.org,Art & Culture,"The Dairy Arts Center was founded in 1992 to provide cooperative workspaces for local artists and venues for live performance in Boulder County. Originally owned by the Watts-Hardy Dairy, the building’s transformation from a former milk-processing facility to a thriving multi-disciplinary arts hub for Boulder and beyond is a nationally recognized example of constructive urban development and renewal.

The Dairy’s founders envisioned a community arts center where artists of all genres would create and inspire each other and the greater community. Today, this dream of shared art making is a thriving reality. The Dairy’s 42,000 square foot facility houses disciplines ranging from visual arts, theater, and film to dance and music.

A professional environment complete with art galleries, performance venues, teaching studios, offices, rehearsal spaces, dance studios, and a 60-seat art-house cinema, it is Boulder's largest multi-disciplinary arts center. The Dairy's audience spans all ages, backgrounds and ability levels, from young student to seasoned performer and from first-time to seasoned theatergoers. Our audience is inclusive of all ages and backgrounds as well as adults and children of various cultures and levels of ability; our facility is accessible to persons with physical mobility challenges.","The Dairy Arts Center provides diverse opportunities to create, learn, and engage in high quality performing, cinematic, and visual arts experiences.",https://tickets.thedairy.org/ArticleMedia/Images/branding/Dairy-Arts-Center-Logo-Color-sm.png,1992,"$9,465,500","$1,245,393","$1,299,316",https://www.guidestar.org/FinDocuments/2016/841/149/2016-841149609-0d9de945-9.pdf
286,Democratic Women Of Boulder County,32 CANON PARK,Boulder,CO,80302,http://demwomenboco.org/,NULL,info@http://demwomenboco.org,Civic,The mission of the Democratic Women of Boulder County (DWBC) is to promote community responsibility and to encourage informed active participation in Democratic party politics.,The mission of the Democratic Women of Boulder County (DWBC) is to promote community responsibility and to encourage informed active participation in Democratic party politics.,http://demwomenboco.org/wp-content/uploads/2014/10/DWBCLogo-1-300x167.png,2014,NULL,NULL,NULL,NULL
287,Dharma Ocean Foundation,2525 ARAPAHOE AVE UNIT E4 # 828,Boulder,CO,80302,https://www.dharmaocean.org/,303-955-2574,info@dharmaocean.org,Religious,"Dharma Ocean is a community of meditators, in Colorado, North America, and around the world, following the path of embodied spirituality. Dharma Ocean is a non-monastic, householder based lineage, a community of householder yogins and yoginis, who prioritize the practice of Somatic Meditation in their lives.

Although we are an inspired and vibrant community, and although there is a deep caring for one another, Dharma Ocean is not an organized religion. We are a large and diffuse community without any definite boundaries, but one linked by a common inspiration toward the body and a common love of life. There is no “signing on the dotted line” or any series of requirements for you to be part of our community of somatic practitioners. Simply by connecting with the somatic teachings, you are already a member of this lineage and the flame of this lineage is already beginning to burn brightly within you. How you want to position yourself in relation to your other fellow practitioners is entirely up to you.","Dharma Ocean is a community of meditators, in Colorado, North America, and around the world, following the path of embodied spirituality. ",https://scontent.fapa1-1.fna.fbcdn.net/v/t1.0-1/4758_48380019989_5848231_n.jpg?_nc_cat=106&_nc_ht=scontent.fapa1-1.fna&oh=594c776184d8da00cff86ad833c6731d&oe=5C69B4BF,2006,"$6,098,326","$1,675,318",NULL,https://www.guidestar.org/FinDocuments/2016/202/417/2016-202417344-0eac38c6-9.pdf
288,Downtown Boulder Partnership,1942 BROADWAY STE 301,Boulder,CO,80302,https://www.boulderdowntown.com/,303-449-3774,NULL,Civic,"The Downtown Boulder Partnership (DBP), formerly Downtown Boulder, Inc., is a 501c6 nonprofit organization dedicated to the preservation and enhancement of downtown as the heart of the greater Boulder community. As the umbrella organization for the Downtown Boulder Business Improvement District (BID) and the Downtown Boulder Foundation (DBF), the Partnership works tirelessly to make our downtown a national model of success.",The Downtown Boulder Partnership (DBP) is dedicated to the preservation and enhancement of downtown as the heart of the greater Boulder community.,https://www.boulderdowntown.com/_img/DB-Logo-One-Line.png,1986,"$295,035","$570,765",NULL,https://www.boulderdowntown.com/
289,El Centro Amistad,2222 14TH ST,Boulder,CO,80302,https://www.elcentroamistad.org/,(303) 443-9899,amistad@elcentroamistad.org,Human Services,"To create opportunities and programs that  promote education, health, and quality of life for the Latino community in Boulder County.","To create opportunities and programs that  promote education, health, and quality of life for the Latino community in Boulder County. ","https://static.wixstatic.com/media/062a30_5e730982b87043128baac454220df7f9~mv2.jpg/v1/fill/w_173,h_173,al_c,q_80,usm_0.66_1.00_0.01/062a30_5e730982b87043128baac454220df7f9~mv2.webp",2003,"$74,068","$276,289",NULL,https://www.guidestar.org/FinDocuments/2017/953/498/2017-953498639-0efb13fc-9.pdf
