,charity_name,address,city,state,zipcode,url,phone_number,email,category_name,charity_description,charity_tag,logo,ruling_year,assets,income,expenses,irs_form
85,Motus Theater,4519 8TH ST UNIT C,Boulder,CO,80304,http://motustheater.org/,303-440-3682,motuscommunity@gmail.com,Art & Culture,"Storytelling is at the heart of what makes us human. We focus on bringing marginalized voices or silenced histories to the stage.  We support inclusion by expanding our audiences’ experiences of the variety of stories that make up our community.  By using theater to learn and listen across the gaps of difference we weave a tighter, stronger and more integrated community.  When you support Motus you are supporting the most powerful and efficacious type of theater – theater with high aesthetic value that is created by the community and for the community. We hope you will gather around the fire with us: share your stories and learn new ones.",The mission of Motus Theater is to create original theater to facilitate dialogue on critical issues of our time. We aim to use the power of art to build alliances across diverse segments of our community.,http://motustheater.org/wp-content/uploads/2015/10/logo.jpg,2012,"$158,357","$232,105","$177,062",http://www.guidestar.org/ViewEdoc.aspx?eDocId=4276082&approved=True
86,Mount Zion Lutheran Church & School,1680 BALSAM AVE,Boulder,CO,80304,http://www.mtzionboulder.org/,303-443-4151,office@mtzionboulder.org,Religious," Mt. Zion Lutheran Church is a congregation of the Lutheran Church - Missouri Synod. Since 1956, the church has been an active member of the Boulder community, offering worship opportunities and providing Christian education programs to children, youth and adults. If you are new to the area and looking for a church home, we invite you to join us. Perusing the pages of this website will provide an introduction.

Mt. Zion Lutheran Preschool is a state-certified and full-service child care program for toddlers through age four. Check out the pages on this website for details. The program offers a complete educational program for toddlers through pre-kindergarten and full day child care. The program operates all year long.","Mt. Zion Lutheran Church is a congregation of the Lutheran Church - Missouri Synod. Since 1956, the church has been an active member of the Boulder community, offering worship opportunities and providing Christian education programs to children, youth and adults.",http://www.mtzionboulder.org/images/layout_parts/header112013.png,1941,NULL,NULL,NULL,NULL
87,Mountain Flower Urban Goat Dairy,3240 BROADWAY ST,Boulder,CO,80304,http://mountainflowerdairy.com/,518-605-8382,Taber@mountainflowerdairy.com,Environment,"Mountain Flower creates experiential education modules to enable adult and youth to learn to see themselves not only as consumers, but as important land stewards who are essential to ecological and animal health and wellness. Program participants engage in the basics of goat care – feeding alfalfa and grain, providing clean water, cleaning pens and composting waste. We also teach necessary skills for clean and humane food production to educate future farmers.

In concert with the growing national movement for local food, ecological awareness, and sustainable living, Mountain Flower cultivates people’s connection to what nourishes us, and in so doing ensures that people will protect and restore our local ecosystem for generations to come.","Our vision comprises three interrelated goals - COMMUNITY, ENGAGEMENT, & EDUCATION",https://mountainflowerdairy.com/wp-content/uploads/2017/03/MFGD-Logo-Header-GreyBG.jpg,2014,"$36,354","$108,366",NULL,http://www.guidestar.org/FinDocuments/2016/461/341/2016-461341252-0e9e3468-Z.pdf
88,Namaste Solar Foundation Inc,4571 BROADWAY ST,Boulder,CO,80304,https://www.namastesolarfoundation.org/,NULL,NULL,Environment,Propagating renewable energy for socially responsible organizations.,Propagating renewable energy for socially responsible organizations.,https://www.namastesolarfoundation.org/uploads/9/5/7/2/95727180/published/nsf-logo-hands-only.jpg?1485900762,2013,$25,"$122,067",NULL,http://www.guidestar.org/FinDocuments/2016/462/148/2016-462148950-0ea0d1a7-F.pdf
89,Nami Boulder County Inc,3470 BROADWAY ST,Boulder,CO,80304,https://namibouldercounty.org/,303.443.4591,info@namibouldercounty.org,Health,"NAMI, the National Alliance on Mental Illness, is the nation’s largest grassroots mental health organization dedicated to building better lives for the millions of Americans affected by mental illness.
What started as a small group of families gathered around a kitchen table in 1979 has grown into the nation’s leading voice on mental health.

NAMI Boulder County evolved from an organization called Families and Friends of the Adult Mentally Ill (FFAMI), which was founded in Boulder in 1977 by Mary Jean Willis. FFAMI members attended the founding convention for NAMI National in 1979.

Today, NAMI is an association of hundreds of local affiliates, state organizations and volunteers who work in your community to raise awareness and provide support and education that was not previously available to those in need.

NAMI Boulder County serves Boulder and Broomfield Counties. Our members are families, friends, and individuals coping with mental illness. NAMI Boulder County members are available when you most need a helping hand through the struggles and challenges of mental illness. NAMI is there with acceptance, understanding, information and emotional support.","NAMI, the National Alliance on Mental Illness, is the nation’s largest grassroots mental health organization dedicated to building better lives for the millions of Americans affected by mental illness.",https://426isg3azehszl2m72sfbhez-wpengine.netdna-ssl.com/wp-content/uploads/sites/187/2017/12/0000000049_color.jpg,2001,NULL,NULL,NULL,NULL
90,Natural Transitions Funeral Guidance,780 QUINCE CIR,Boulder,CO,80304,https://www.naturaltransitions.org/,303 520 1759,NULL,Human Services,"We are a non-profit RESOURCE CENTER 501(c) (3) providing education on conscious, holistic, and green approaches to end of life, including family-directed home-based after-death care also known as “home funerals.”","We are a non-profit RESOURCE CENTER 501(c) (3) providing education on conscious, holistic, and green approaches to end of life, including family-directed home-based after-death care also known as “home funerals.”",https://scontent-msp1-1.xx.fbcdn.net/v/t1.0-9/1903021_10151864432341176_456879206_n.jpg?_nc_cat=104&_nc_ht=scontent-msp1-1.xx&oh=c7836d85c637e1591c3b1df88b8d8b91&oe=5C6B9FA7,2004,"$30,467","$18,395",NULL,http://www.guidestar.org/FinDocuments/2016/770/621/2016-770621166-0e3c45e3-Z.pdf
91,New Horizons School,1825 UPLAND AVE,Boulder,CO,80304,http://newhorizonspreschoolboulder.org/,(303) 442-7434,NULL,Education,"New Horizons Cooperative Preschool offers a half-day, play-based, bilingual preschool program for children aged 2.5 to 7 years old. Founded in 1968, our goal is to bring together families and children who are traditionally separated by ethnicity, class, race, and culture.  For nearly 50 years, New Horizons has continued to operate as a collaborative effort of parents, teachers, and community members to foster diversity and to educate one another.

Located in north Boulder near 19th St. and Upland Ave in quiet and calm neighborhood, the preschool has abundant opportunities and space inside and outside to learn, play and grow. Our large, tree shaded yard is a magical place for children – with play structures to boost gross motor skills, intimate areas for pretend play, friendly next door goats to interact with, a garden to dig in, bikes and trikes for exercise, and sand to boxes to build and dig in.","New Horizons Cooperative Preschool offers a half-day, play-based, bilingual preschool program for children aged 2.5 to 7 years old.",http://newhorizonspreschoolboulder.org/wp-content/uploads/2017/09/newhorizons-logo.png,1972,"$146,545","$203,223",NULL,http://www.guidestar.org/FinDocuments/2017/840/586/2017-840586417-0eb5f278-9.pdf
92,Nobo Art District,1510 ZAMIA AVE APT 102,Boulder,CO,80304,https://noboartdistrict.org/,NULL,NULL,Art & Culture,"The NoBo Art District is an inclusive, grassroots, community-focused organization dedicated to promoting artists and creative businesses located along Broadway and the adjoining neighborhoods in north Boulder, Colorado. The NoBo area is characterized by upscale, mixed-use new urbanism, high-end restaurants and shops, and a mix of funky, artist-friendly warehouses. The NoBo Art District creates opportunities for artists to connect with each other and the broader community promoting engagement through art, education and events.",Promoting and supporting artists and creative industries in North Boulder.,https://noboartdistrict.org/wp-content/uploads/2016/05/NoBoLOGO-1x.png,2016,NULL,NULL,NULL,NULL
93,Passageways Institute Inc,3050 BROADWAY ST STE 203,Boulder,CO,80304,http://passageworks.org/,303.247.0156,info@passageworks.org,Education,"Our mission is to support educators to integrate social, emotional and academic learning and create relationship-based classrooms that are inclusive, meaningful and engaged.

Our vision is of an education system in which all young people are supported to develop compassion, character, academic excellence, and a sense of deep connection to themselves and the world around them.

PassageWorks practices and principles support the inner lives of teachers and students. By “inner life” we refer to that essential aspect of human nature that yearns for deep connection, grapples with difficult questions about meaning, and seeks a sense of purpose and genuine self-expression.","Our mission is to support educators to integrate social, emotional and academic learning and create relationship-based classrooms that are inclusive, meaningful and engaged.",http://passageworks.org/wp-content/uploads/2013/03/PW-Logo-final-ai-4.24.13-transparent-300x56.png,2003,"$84,324","$523,694","$28,674",http://www.guidestar.org/FinDocuments/2016/481/278/2016-481278766-0e4319bf-9.pdf
94,Philanthropy Project,2722 ARBOR GLEN PL,Boulder,CO,80304,https://philanthropyproject.com/,(720) 593-2390,info@philanthropyproject.com,Civic,"There are countless online giving platforms that make it easier for adults to rally a community of supporters and affect meaningful change. But we realized that nothing of the sort was available to young changemakers. How can we expect youth to change the world if they don't have the proper tools at their disposal? It just didn't seem fair.

So we set out to talk to hundreds of youngsters and find out what tools they really wanted and needed to turn their ideas into impact. And then we built a platform with all of these tools that is both user-friendly, and safe for youth of all ages. Now, young changemakers can leverage our technology to build a community, spread the word about their cause and maximize their impact.",We built the first ever youth-focused giving platform to make it easier for young people to take action.,https://philanthropyproject.com/wp-content/uploads/2018/02/TPP-1.png,2015,NULL,NULL,NULL,http://www.guidestar.org/FinDocuments/2015/473/192/2015-473192732-0c9c8ddf-Z.pdf
95,Pine Brook Hills Homeowners Association Inc,1907 LINDEN DR,Boulder,CO,80304,https://www.pinebrookhills.org/HOA/HOA.html,NULL,NULL,Civic,"HOA general membership meetings are held quarterly (or as needed) at the Pine Brook Hills Community Center, located at 1905 Linden Drive. Usually the meetings fall on the last Tuesday evening in January, April, July, and October and cover topics of interest to homeowners. All HOA meetings are announced on the PBH website and on signs at the Linden Drive entrance of the neighborhood. Any changes in the dates would be announced in these same locations. Ideas, issues, and suggestions are freely discussed by all those attending.

Opportunities are provided for residents to meet and socialize. The Pine Brook Socials are informal and friendly. There is usually one social event in the summer and one in the winter. Additionally, pot-luck gatherings are often held before the HOA membership meetings.

The Pine Brook Press is a wonderful quarterly publication that provides information about HOA and neighborhood activities, programs, events, and issues. The “Press” also contains community news and articles of interest to residents of the Pine Brook Hills neighborhood.

With the participation and support from all of us, life in Pine Brook Hills can be made even more enjoyable.","The Pine Brook Hills Home Owners Association is an all-volunteer, non-profit organization. The overarching purpose of the HOA is to cultivate a strong, sustainable, vibrant, and attractive community and to enhance the quality of life and well-being of the residents of Pine Brook Hills.",https://www.pinebrookhills.org/images/sign.png,2000,NULL,NULL,NULL,NULL
96,Protect Our Winters,311 MAPLETON AVE SUITE 221A,Boulder,CO,80304,https://protectourwinters.org/,(303) 900-4027,info@protectourwinters.org,Environment,"The past decade has been the warmest on record. 2016 was the  hottest year ever recorded and 2017 is already on track top it. Meanwhile, the northern hemisphere has already lost a million square miles of spring snowpack since 1970—an area three times the size of Texas.  Snow levels are rising in elevation and winters are shorter. Climate change is already  affecting winter.

By 2007, pro snowboarder Jeremy Jones found that more and more resorts he’d always counted on for good riding were closed due to lack of snow. Something was clearly going on, and he felt the need to act. But he couldn’t find any organizations focused on mobilizing the snowsports community on climate—there was a gap between the impacts that climate change was already having on our mountains, and any organized action being taken to address it. And so Jeremy founded Protect Our Winters.

Soon afterwards, we brought on other concerned pro athletes, individuals, resorts and winter sports companies. Since then, Protect Our Winters has grown from a kernel of an idea into a worldwide network of over 130,000 supporters – a social movement on climate, designed to activate a passionate community and create the political will for meaningful action by state and federal policymakers.","Protect Our Winters (POW) is a 501(c)(3) nonprofit. Founded by professional snowboarder Jeremy Jones in 2007, POW turns passionate outdoor people into effective climate advocates. POW leads a community of athletes, thought pioneers and forward-thinking business leaders to affect systemic political solutions to climate change.",https://gzg764m8l73gtwxg366onn13-wpengine.netdna-ssl.com/wp-content/themes/pow/img/logo.png,2007,"$621,335","$950,140","$725,068",http://www.guidestar.org/FinDocuments/2016/208/474/2016-208474909-0e1cb712-9.pdf
97,Reachout Crestview,1897 SUMAC AVE,Boulder,CO,80304,http://www.rocv.org/,720.561.5461,rocvsecretary@gmail.com,Education,"ReachOut Crest View (ROCV), Crest View Elementary School’s parent-teacher organization, is chartered to raise funds to support academic enrichment, scholarship needs and capital improvements, provide activities and events to develop and strengthen the school community, and sponsor periodic forums and events for parent education on issues related to elementary education and children.  This is ROCV’s website where you will find up to date information on what’s going on at Crest View and how you can be a part of it!","ReachOut Crest View (ROCV), Crest View Elementary School’s parent-teacher organization, is chartered to raise funds to support academic enrichment, scholarship needs and capital improvements, provide activities and events to develop and strengthen the school community, and sponsor periodic forums and events for parent education on issues related to elementary education and children.",https://scontent-msp1-1.xx.fbcdn.net/v/t31.0-8/1795443_908868629140455_1833689383707379360_o.jpg?_nc_cat=111&_nc_ht=scontent-msp1-1.xx&oh=9e3e190c6222ae765b2aa07241287d65&oe=5C6B6D34,1999,"$82,603","$172,772",NULL,http://www.guidestar.org/FinDocuments/2017/841/512/2017-841512387-0eb8a39e-Z.pdf
98,Reclaimtheamericandreamorg,2424 KELLER FARM DR,Boulder,CO,80304,http://reclaimtheamericandream.org/,NULL,dreamteam@reclaimtheamericandream.org,Civic,"Our political system is broken. Our economy isn’t fair. We keep telling Washington to fix things, but Washington has been corrupted by MegaMoney and captured by crony capitalism. We can’t wait any longer. It’s time for us to take action.

We get it, but we’re not sure where to begin. People worry that reform is impossible. Not true. It’s already happening in many places. Average Americans are making change happen at the grass roots. Their stories are inspiring. We can learn from them. Working together in our home states and communities, We the People can reclaim the American Dream.

That’s what this website is for – for sharing progress, restoring democracy, making our economy fairer. Our mission is to help you make change. We are non-partisan. We don’t have one pet solution we’re pushing. We’ve profiled several issues. We’ll do more. You decide. The main point is for you to get engaged, get active.

Our goal is to help you get started. Newcomers need an entry point to various pathways of reform. So we’re your gateway. We’re here to explain the issues. To show you where things are happening. To tell you success stories. To help you connect with organizations already at work on reform. So let’s get started.","Restore Democracy, Reduce Inequality, Rebuild Power of the People",https://scontent-msp1-1.xx.fbcdn.net/v/t1.0-9/11149257_1571456063103208_4560345134757213275_n.png?_nc_cat=108&_nc_ht=scontent-msp1-1.xx&oh=a24b1e869db5fe6521b8f454efa3345c&oe=5CA7BA01,2016,"$112,522","$137,200",NULL,http://www.guidestar.org/FinDocuments/2017/812/663/2017-812663346-0e34f9c0-Z.pdf
99,Recovery Trust,2818 13TH ST,Boulder,CO,80304,http://recoverytrust.org/,303-440-5140,NULL,Civic,"People with serious mental illness and their families are a highly stigmatized group. Our news media and daytime TV shows portray the mentally ill as violent criminals or, at best, figures of fun. This stereotype of the mentally ill person leads to all kinds of misconceptions—that they are likely to be dangerous and incapable, that their illness is due to ""lack of discipline"" and that they are more responsible for their condition than are people with any other illness or disorder. Worse still, people with mental illness, themselves, and their family members share these misconceptions.

There are many consequences of stigma—people diagnosed with mental illness lose their sense of power and self–worth, health curricula in schools ignore serious mental illness and families feel isolated from their neighbors and, often, from the treatment providers. See how our programs seek to tackle these issues through providing education and support for people with mental illness and their families and creating work opportunities for those with an illness.",Creating Community-Based Vocational Opportunities For People With Mental Illness And Providing Support And Education To Their Families.,http://recoverytrust.org/images/logo.jpg,2012,NULL,NULL,NULL,http://www.guidestar.org/FinDocuments/2015/352/432/2015-352432846-0d4055a6-Z.pdf
100,Ridgeview Fund,1542 HIGH ST,Boulder,CO,80304,https://www.ridgeviewmedical.org/about-us/ridgeview-foundation,952-442-2191,NULL,Health,"Founded in 1978, Ridgeview Foundation has made an indelible impact by helping Ridgeview Medical Center deliver on its mission to enhance the health of people it serves by creating a culture that nurtures the whole person: mind, body and spirit. The Foundation, an independent, nonprofit organization, is guided by a volunteer board of directors whose members are representative of communities within Ridgeview’s service area. Together, staff and the boards of directors of the Foundation and Ridgeview Medical Center collaborate to identify funding priorities. View a list of projects philanthropy has funded at Ridgeview.","Our mission is to enhance the health of people it serves by creating a culture that nurtures the whole person: mind, body and spirit.",https://www.ridgeviewmedical.org/images/logo-ridgeview-medical.png,2010,NULL,NULL,NULL,NULL
101,Right Use Of Power Institute,1485 SUMAC AVE,Boulder,CO,80304,http://www.rightuseofpower.org/,720-504-7874,NULL,Civic,"Founded in 2011, the Right Use of Power Institute (RUPI), is a 501(c)(3) non-profit. 

The Institute was formed to further the reach of the Right Use of Power mission. This non-profit organization serves professionals, the general public, and members of the Right Use of Power Guild.

All Guild members are trained to facilitate Right Use of Power programs as adapted to particular topics or to fit the needs of specialized groups. Guild members have access to a members-only website with a library, discussion area, membership lists, partner organization references, networking functions, and creative brainstorming and program development tools. Guild members are active in many global locations as shown on the map at this site.  

The Right Use of Power Institute publishes a free newsletter and blog and makes available articles, books, programs and e-courses for professional Continuing Education Credits and for personal development. RUPI also supports Guild members in marketing their workshops and special programs. Guild members are affiliated but not employed or certified by either Dr. Cedar Barstow or RUPI.","The mission of the nonprofit Right Use of Power Institute (RUPI) is to assist in creating a global culture of peace through vital education in the right use of personal, professional, status, and collective power. ",http://www.rightuseofpower.org/uploads/4/0/8/4/4084811/1396116176.png,2014,NULL,NULL,NULL,NULL
102,Rocky Mountain Chorale,1860 ELDER AVE,Boulder,CO,80304,http://rockymtnchorale.org/,303-442-5081,mail@rockymtnchorale.org,Art & Culture,The Rocky Mountain Chorale was founded in 1978 by a group of singers who wanted more options for singing in a community choir. It has been bringing the joy of chorale music to Boulder ever since.,The Rocky Mountain Chorale was founded in 1978 by a group of singers who wanted more options for singing in a community choir. It has been bringing the joy of chorale music to Boulder ever since.,https://scontent-msp1-1.xx.fbcdn.net/v/t1.0-9/12074768_10153502317397702_6351282628159713543_n.png?_nc_cat=106&_nc_ht=scontent-msp1-1.xx&oh=5804a82541460d20fff745762c28f4aa&oe=5C73403A,1982,NULL,NULL,NULL,NULL
103,Rocky Mountain Church Of Christ Of Boulder,4360 BROADWAY ST,Boulder,CO,80304,https://rocky.church/,303.652.2211,info@rocky.church,Religious,"At Rocky, we believe in taking every opportunity to help others to know Jesus and love like Him. The time is now for you and the time is now for us.","Rocky Mountain Christian Church is a non-denominational, Christian Church.",https://rocky.church/wp-content/themes/rmcc2017/images/header-logo.png,1974,NULL,NULL,NULL,NULL
104,Rocky Mountain Peace And Justice Center,3970 BROADWAY UNIT B-5,Boulder,CO,80304,https://www.rmpjc.org/,(303) 444-6981,rmpjc@earthlink.net,Civic,"Rooted in the spirit of unconditional nonviolence, the Rocky Mountain Peace and Justice Center is dedicated to radically progressive personal and social change. We are a multi-issue organization that works to restore and protect Earth and human rights. We educate, organize, act and build community in order to create a culture of justice and peace.","Rooted in the spirit of unconditional nonviolence, the Rocky Mountain Peace and Justice Center is dedicated to radically progressive personal and social change.","https://static.wixstatic.com/media/76432a_3d769b3c78264ea395f960794f23c258~mv2.png/v1/fill/w_264,h_138,al_c,q_80,usm_0.66_1.00_0.01/76432a_3d769b3c78264ea395f960794f23c258~mv2.webp",1984,"$201,078","$125,307",NULL,http://www.guidestar.org/FinDocuments/2016/742/302/2016-742302470-0e836919-Z.pdf
105,Rocky Ridge Music Center Foundation,3970 BROADWAY ST STE 201E,Boulder,CO,80304,http://www.rockyridge.org/,303-449-1106,rrmc@rockyridge.org,Art & Culture,"Founded in 1942, Rocky Ridge Music Center is dedicated to providing transformative music education at both our historic summer campus in Estes Park, CO and our newly established year-round Music Academy in Boulder and Denver, CO.  The Center’s programs give students of all ages and levels a variety of opportunities to work with exceptional artists, teachers, and colleagues from around the world. Rocky Ridge encourages participants to engage in lifelong music-making and to build creative communities where they live and work.","Founded in 1942, Rocky Ridge Music Center is dedicated to providing transformative music education at both our historic summer campus in Estes Park, CO and our newly established year-round Music Academy in Boulder and Denver, CO.  The Center’s programs give students of all ages and levels a variety of opportunities to work with exceptional artists, teachers, and colleagues from around the world. Rocky Ridge encourages participants to engage in lifelong music-making and to build creative communities where they live and work.",https://www.rockyridge.org/wp-content/themes/rockyridge/dist/images/logo.svg,1961,"$1,045,132","$759,813","$552,524",http://www.guidestar.org/FinDocuments/2017/846/035/2017-846035931-0eff03e2-9.pdf
